verse_no,en,hmr
1,"And Jehovah said unto me, Take thee a great tablet, and write upon it with the pen of a man, For Maher-shalal-hash-baz;","Chun, LALPA chun ka kuomah, “Lekha ziekna phêk lientak la la, mihriem kawlawmin a chungah, ‘Mahersalal-has-baz ta ding,’ tiin ziek rawh;"
2,"and I will take unto me faithful witnesses to record, Uriah the priest, and Zechariah the son of Jeberechiah.","chuongchun, hretu ringum, thiempu Uria le Jeberekia naupa Zekaria chu hrietpuitu dingin siem ka tih,” a ta."
3,"And I went unto the prophetess; and she conceived, and bare a son. Then said Jehovah unto me, Call his name Maher-shalal-hash-baz.","Chun, zâwlneinu kuoma chun ka feh a, chuongchun, ama chun nau a vawn a, naupasal a nei tah a. Chuongchun, LALPAIN ka kuomah, “A hmingah Maher-salal-has-baz sak rawh."
4,"For before the child shall have knowledge to cry, My father, and, My mother, the riches of Damascus and the spoil of Samaria shall be carried away before the king of Assyria.","Naupang chun, ‘Nu, Pa,’ ti na- châng a hriet hma khawmin Damas- ka hausaknahai le Samaria inthawka râllâk sumhai chu Assuria lal hmaah an fe hmangpui ding a ni sih a,” a ta."
5,"And Jehovah spake unto me yet again, saying,","Chun, LALPA chun ka kuomah a hril nâwk a,"
6,"Forasmuch as this people have refused the waters of Shiloah that go softly, and rejoice in Rezin and Remaliah’s son;","“Hieng chihai hin Siloa tui damtêa luong dêl dêlhai chu an dit naw lei le, Rezin le Remalia naupa chunga an lâwm leiin,"
7,"now therefore, behold, the Lord bringeth up upon them the waters of the River, strong and many, even the king of Assyria and all his glory: and it shall come up over all its channels, and go over all its banks;","ngai ta, LALPA chun Vadungpui tui, hrâttakhai le tamtakhai, (Assu- ria lal le a ropuina po po chu) an chungah inluongtir a tih; chuong- chun, a kuong po po chu hung liem dûl dûlin, a pang po poa chun hung liem dûl dûl a tih;"
8,"and it shall sweep onward into Judah; it shall overflow and pass through; it shall reach even to the neck; and the stretching out of its wings shall fill the breadth of thy land, O Immanuel.","chun, Juda ram chenin chîm tlum dum dum a ta, a liemin luong tlang dum dum a ta, rîng khawm chîm phâk hiel a tih; chun, a thla zar chun, Aw Immanuel, i ram khang tieng po po hi aw vawng a tih."
9,"Make an uproar, O ye peoples, and be broken in pieces; and give ear, all ye of far countries: gird yourselves, and be broken in pieces; gird yourselves, and be broken in pieces.","“Chi tinhai, buoi nuoi nuoi ta unla, kawinawiin in um ding a nih; ram hlataka mi po pohai, na sit unla, inrâlthuom ro; kawinâwiin in um ding a nih; inrâlthuom ro, kawi- nâwiin in um ding a nih."
10,"Take counsel together, and it shall be brought to nought; speak the word, and it shall not stand: for God is with us.","Inrâwn khâwm ro, iengkhawm ni hliek naw ni; thu hril ro, puitling chuong bawk naw nih; Pathien ei kuomah a um sih a,” tiin."
11,"For Jehovah spake thus to me with a strong hand, and instructed me not to walk in the way of this people, saying,","LALPA chun kut hrâttakin hieng ang hin ka kuomah a hril a, hi chihai lampuia hin ka fe ve nawna dingin a mi thunun a ni hi:"
12,"Say ye not, A conspiracy, concerning all whereof this people shall say, A conspiracy; neither fear ye their fear, nor be in dread thereof.","“Hi chihai hin, ‘Phier an nei,’ an ti nazawng chu, ‘Phier an nei,’ ti ve naw ro; an ṭi khawm chu ṭi ve loin, ṭi ve naw ro."
13,"Jehovah of hosts, him shall ye sanctify; and let him be your fear, and let him be your dread.","Sipaihai Lalpa, ama ngei chu in sukthieng ding a nih, ama chu in iṭi chu ni sienla, ama chu in iṭi chu ni raw se."
14,"And he shall be for a sanctuary; but for a stone of stumbling and for a rock of offence to both the houses of Israel, for a gin and for a snare to the inhabitants of Jerusalem.","Chun, ama chu hmun inthieng nîng a ta. Israel sûng hnihai ta ding ruok chun tlûkna lung le dangna lungpui ni lem a tih. Jerusalema umhai ta ding chun châng le bil ni bawk a tih."
15,"And many shall stumble thereon, and fall, and be broken, and be snared, and be taken.","Chuongchun, mi tamtakin chu chu insuiin tlûng an ta, suknâwiin um an ta, âwk an ta, manin um an tih,” tiin."
16,"Bind thou up the testimony, seal the law among my disciples.","Inhriettirna thu ziel hi khuop la, dân thu hi ka inchûktirhai lai namin inchik rawh."
17,"And I will wait for Jehovah, that hideth his face from the house of Jacob, and I will look for him.","Kei chun Jakob sûnghai laia a hmai thuptu LALPA chu nghâk ka ta, ama chu thlîr zing ka tih."
18,"Behold, I and the children whom Jehovah hath given me are for signs and for wonders in Israel from Jehovah of hosts, who dwelleth in mount Zion.","Ngai ta, kei le LALPA mi pêk naupanghai hi, Israelhai lai hin sipaihai LALPA Zion tlânga um kuoma inthawka inchikna ding le thilmakhai ding dâm kan nih."
19,"And when they shall say unto you, Seek unto them that have familiar spirits and unto the wizards, that chirp and that mutter: should not a people seek unto their God? on behalf of the living should they seek unto the dead?","Chun, miin, “Khawhri aisân- thiem zâwl le, dawithiem thûm bul bul le chier hmur hmurhai chu râwn ro,” an ti pha cheu chun hieng ang hin dawn ro; “Mihaiin an Pathien chu an râwn ding a ni lem naw am a nih? Mi hring ta ding chun mithi an râwn ding am a nih?"
20,"To the law and to the testimony! if they speak not according to this word, surely there is no morning for them.","Dân thu le Inhriettirna Thu chu râwn lem ding a nih,” tiin. Chuong ang thu ang peia an hril naw chun an ta dingin khuo hrim hrim var dêr naw nih."
21,"And they shall pass through it, sore distressed and hungry; and it shall come to pass that, when they shall be hungry, they shall fret themselves, and curse by their king and by their God, and turn their faces upward:","Lunginzîngtak le phîngṭâm pumin ram chu fang an ta, an phîng a ṭâm pha chun an lung chu sen êm êm a ta, an lal le an Pathien chu ṭawngsie inphur bawr bawr an ta, vân tieng dâk rak rak an tih;"
22,"and they shall look unto the earth, and, behold, distress and darkness, the gloom of anguish; and into thick darkness they shall be driven away.","chun, hnuoi tieng nghâng an ta, ngai ta, lunginzîngna le inthimna, thlaphâng ngûina chu nîng a tih; chuongchun, inthim sâmupa hnawt hmangin um an tih."
