verse_no,en,hmr
1,"And the second lot came out for Simeon, even for the tribe of the children of Simeon according to their families: and their inheritance was in the midst of the inheritance of the children of Judah.","Chun, aisân pahnina chu Simeon chungah, Simeon thla- hai hnam chungah an sûngkuo izir ang peiin a tlu tah a; an chanpuol chu Juda thlahai chanpuol lai khan a ṭhang ve a nih."
2,"And they had for their inheritance Beer-sheba, or Sheba, and Moladah,","An chanpuola tluhai chu, Beer- seba, Seba, Molada,"
3,"and Hazar-shual, and Balah, and Ezem,","Hazar-sual, Bala, Ezem,"
4,"and Eltolad, and Bethul, and Hormah,","Eltolad, Bethul, Horma,"
5,"and Ziklag, and Beth-marcaboth, and Hazar-susah,","Ziklag, Beth-markaboth, Hazar- susa,"
6,"and Beth-lebaoth, and Sharuhen; thirteen cities with their villages:","Beth-lebaoth le Saruhen, khaw- pui sâwmpathum a khaw chînhai leh."
7,"Ain, Rimmon, and Ether, and Ashan; four cities with their villages:","Ain, Rimmon, Ether le Asan; khawpui pali a khaw chînhai leh;"
8,"and all the villages that were round about these cities to Baalath-beer, Ramah of the South. This is the inheritance of the tribe of the children of Simeon according to their families.","chuong khawpui vêla khaw chîn- hai po po Baalath-beer, simtienga Ramah chenin. Chuong chu a nih Simeon thlahai hnam an sûngkuo izir ang peia an chanpuola ruot chu."
9,Out of the part of the children of Judah was the inheritance of the children of Simeon; for the portion of the children of Judah was too much for them: therefore the children of Simeon had inheritance in the midst of their inheritance.,"Simeon thlahai chanpuol chu Juda thlahai chanpuol laia mi a nih; Juda thlahai chanpuol chu anni ta dingin a lien taluo sih a; chuleiin, Simeon thlahai chanpuol chu an chan lai khan a ṭhang ve a nih."
10,And the third lot came up for the children of Zebulun according to their families. And the border of their inheritance was unto Sarid;,"Chun, aisân pathumna chu Zebulun thlahai chungah an sûngkuo izir ang peiin a tlu tah a; an chanpuol ramri chu Sarid chenin a nih;"
11,"and their border went up westward, even to Maralah, and reached to Dabbesheth; and it reached to the brook that is before Jokneam;","chun, an ramri chu thlangtieng pangah Marala tlung zakin a fe pei a; Dabbeseth a va tlung a, chun, Jokneam saka vadungte a va tlung a;"
12,"and it turned from Sarid eastward toward the sunrising unto the border of Chisloth-tabor; and it went out to Daberath, and went up to Japhia;","Sarida inthawkin saktieng pangah nisa suokna tieng pangah Kisloth-tabor ramri chenin a hang kâwi a; Daberathah a suok a, Japhiaa chun a fe pei a;"
13,"and from thence it passed along eastward to Gath-hepher, to Eth-kazin; and it went out at Rimmon which stretcheth unto Neah;","chun, chutaka inthawk chun saktieng pangah Gitta-hepher le Eth- kazinah a fe pei a; Nea tieng panin Rimmonah a suok a;"
14,and the border turned about it on the north to Hannathon; and the goings out thereof were at the valley of Iphtah-el;,"chun, ramri chu hmârtienga chun Hannathon-ah ân kuol phei a, Iphtahel ruomah a suok a,"
15,"and Kattath, and Nahalal, and Shimron, and Idalah, and Bethlehem: twelve cities with their villages.","chun, Kattath, Nahalal, Sim- ron, Idala le Bethlehem; khawpui sâwmpahni a khaw chînhai leh."
16,"This is the inheritance of the children of Zebulun according to their families, these cities with their villages.",Chuong chu a nih Zebulun thlahai an sûngkuo izir ang peia an chanpuola ruot chu; chuong khawpui- hai le a khaw chînhai chu.
17,"The fourth lot came out for Issachar, even for the children of Issachar according to their families.","Aisân palina chu Issakar chungah, Issakar thlahai an sûngkuo izir ang peiin a tlu tah a;"
18,"And their border was unto Jezreel, and Chesulloth, and Shunem,","an ramri chin chu Jezreel, Kesulloth le Sunem,"
19,"and Hapharaim, and Shion, and Anaharath,","Hapharaim Sion, Anaharath,"
20,"and Rabbith, and Kishion, and Ebez,","Rabbith, Kision, Ebez;"
21,"and Remeth, and Engannim, and En-haddah, and Beth-pazzez,","Remeth, En-gannim, En-hadda le Beth-pazez chenin a nih;"
22,"and the border reached to Tabor, and Shahazumah, and Beth-shemesh; and the goings out of their border were at the Jordan: sixteen cities with their villages.","ramri chu Tabor, Sahazuma le Beth-semes a va tlung a nih; chuong- chun, an ramri suokna chu Jordanah a nih; khawpui sâwmparuk, a khaw chînhai leh."
23,"This is the inheritance of the tribe of the children of Issachar according to their families, the cities with their villages.","Chuong chu a nih Issakar thlahai hnam an sûngkuo izir ang peia an chanpuola ruot chu, khaw- puihai le a khaw chînhai chu."
24,And the fifth lot came out for the tribe of the children of Asher according to their families.,Aisân pangana chu Aser thlahai hnam chungah an sûngkuo izir ang peiin a tlu tah a.
25,"And their border was Helkath, and Hali, and Beten, and Achshaph,","An ramri chin chu Helkath, Hali, Beten, Aksaph,"
26,"and Allammelech, and Amad, and Mishal; and it reached to Carmel westward, and to Shihor-libnath;","Allammelek, Amad le Misal an nih; thlangtieng panga chun Karmel le Sihor-libnath a zu tlung a;"
27,"and it turned toward the sunrising to Beth-dagon, and reached to Zebulun, and to the valley of Iphtah-el northward to Beth-emek and Neiel; and it went out to Cabul on the left hand,","chun, nisa suokna tieng panga chun Beth-dagonah an kuol a, chun, Zebulun le hmârtieng pangah Iphtah- el ruomah Bethemek le Neiel a va tlung a, chun, hmârtieng panga chun fe peiin Kabul,"
28,"and Ebron, and Rehob, and Hammon, and Kanah, even unto great Sidon;","Ebron, Rehob, Hammon, Kana le Sidon ropui tlung zakin a fe pei a;"
29,"and the border turned to Ramah, and to the fortified city of Tyre; and the border turned to Hosah; and the goings out thereof were at the sea by the region of Achzib;","chun, ramri chu Ramaa le Tura khawpui kul neia chun ân kuol phei a; chun, ramri chu Hosaah ân kuol phei pei a, chuongchun, Akzib ram tuisuorietah a suok a."
30,"Ummah also, and Aphek, and Rehob: twenty and two cities with their villages.","Umma, Aphek le Rehob, khaw sâwmhni pahni le a khaw chînhai leh,"
31,"This is the inheritance of the tribe of the children of Asher according to their families, these cities with their villages.","Chuong chu a nih Aser thlahai hnam an sûngkuo izir ang peia an chanpuol chu, chuong khawpuihai le a khaw chînhai chu."
32,"The sixth lot came out for the children of Naphtali, even for the children of Naphtali according to their families.",Aisân parukna chu Naphtali thlahai chungah an sûngkuo izir ang pei bawkin Naphtali thlahai chung ngeiah a tlu tah a.
33,"And their border was from Heleph, from the oak in Zaanannim, and Adami-nekeb, and Jabneel, unto Lakkum; and the goings out thereof were at the Jordan;","An ramri chin chu Helepha inthawk dâm, Zanannima thingsai- suoa inthawk dâm, Adami-nekeb le Jabneela inthawka Lakkum chenin a nih; chun, a suokna chu Jordanah a nih;"
34,"and the border turned westward to Aznoth-tabor, and went out from thence to Hukkok; and it reached to Zebulun on the south, and reached to Asher on the west, and to Judah at the Jordan toward the sunrising.","chun, ramri chu thlangtieng panga chun Aznoth-taborah a fe thlah a; chutaka inthawkin Hukkok- ah a feh a; chun, simtienga chun Zebulun a va tlung a, thlangtienga chun Aser a tlung a, chun, nisa suokna tienga chun Juda rama Jordan a hang tlung a."
35,"And the fortified cities were Ziddim, Zer, and Hammath, Rakkath, and Chinnereth,","Chun, khawpui kul nei mihai chu Ziddim, Zer, Hammath, Rakkath, Kinnereth,"
36,"and Adamah, and Ramah, and Hazor,","Adama, Rama, Hazor,"
37,"and Kedesh, and Edrei, and En-hazor,","Kedes, Edrei, En-hazor,"
38,"and Iron, and Migdal-el, Horem, and Beth-anath, and Beth-shemesh; nineteen cities with their villages.","Iron, Migdal-el, Horem, Beth- anath le Beth-semes an nih; khawpui sâwmpakuo a khaw chînhai leh,"
39,"This is the inheritance of the tribe of the children of Naphtali according to their families, the cities with their villages.","Chuong chu a nih Naphtali thlahai hnam an sûngkuo izir ang peia an chanpuol chu, khawpuihai le a khaw chînhai chu."
40,The seventh lot came out for the tribe of the children of Dan according to their families.,Aisân pasarina chu Dan thlahai hnam chungah an sûngkuo izir ang peiin a tlu tah a.
41,"And the border of their inheritance was Zorah, and Eshtaol, and Ir-shemesh,","An chanpuol ramri chu Zora, Estaol, Ir-semes,"
42,"and Shaalabbin, and Aijalon, and Ithlah,","Saalabin, Aijalon, Ithla,"
43,"and Elon, and Timnah, and Ekron,","Elon, Timna, Ekron,"
44,"and Eltekeh, and Gibbethon, and Baalath,","Elteke, Gibbethon, Baalat,"
45,"and Jehud, and Bene-berak, and Gath-rimmon,","Jehud, Bene-berak, Gath- rimmon,"
46,"and Me-jarkon, and Rakkon, with the border over against Joppa.","Me-jarkon, Rakkon, Joppa dep ramhai le khan an nih."
47,"And the border of the children of Dan went out beyond them; for the children of Dan went up and fought against Leshem, and took it, and smote it with the edge of the sword, and possessed it, and dwelt therein, and called Leshem, Dan, after the name of Dan their father.","Dan thlahai ramri chun chuong chu a va khêl a, Dan thlahai chun Lesem an hang do a, an lâk a, kâwl- hnâmin an sukbohmang a, an nei tah a; chutaka chun an um nghâl ta a, an pu Dan hming chu chawi- in Lesem chu Dan an lo inbûk tah a nih."
48,"This is the inheritance of the tribe of the children of Dan according to their families, these cities with their villages.","Chuong chu a nih Dan thlahai hnam an sûngkuo izir ang peia an chanpuol chu, chuong khawpuihai le a khaw chînhai le chun."
49,So they made an end of distributing the land for inheritance by the borders thereof; and the children of Israel gave an inheritance to Joshua the son of Nun in the midst of them:,"Chuongchun, an chanpuol ding anga ramri siem ang peiin ram chu an lo sem zo tah a; chuongchun, Israel thlahai chun Nun naupa Josua chu anni lai chanpuol an siempêk veh a;"
50,"according to the commandment of Jehovah they gave him the city which he asked, even Timnath-serah in the hill-country of Ephraim; and he built the city, and dwelt therein.","LALPA thupêk angin Ephraim tlâng rama a khawpui hni Timnath- Sera khuo chu an pêk a; chun, khawpui chu a siem ṭha a, chutaka chun a um tah a."
51,"These are the inheritances, which Eleazar the priest, and Joshua the son of Nun, and the heads of the fathers’ houses of the tribes of the children of Israel, distributed for inheritance by lot in Shiloh before Jehovah, at the door of the tent of meeting. So they made an end of dividing the land.","Chuonghai chu a nih thiempu Eleazar hai, Nun naupa Josua hai le Israel thlahai hnam sûngkuo upahai- in Siloa LALPA hmaa inbiekna puon in kawtkhâra aisâna an rochan dinga an lo sempêk tahai chu, chuongchun, ram ṭhe chu an zo tah a nih."
