verse_no,en,hmr
1,"The sons of Levi: Gershon, Kohath, and Merari.","Levi naupasalhai chu: Gerson, Kohath le Merari."
2,"And the sons of Kohath: Amram, Izhar, and Hebron, and Uzziel.","Kohath naupasalhai chu: Amram, Izhar, Hebron le Uzziel an nih."
3,"And the children of Amram: Aaron, and Moses, and Miriam. And the sons of Aaron: Nadab, and Abihu, Eleazar, and Ithamar.","Amram nauhai chu: Aron, Mosie le Miriam. Aron naupasalhai chu: Nadab, Abihu, Eleazar le Ithamar an nih."
4,"Eleazar begat Phinehas, Phinehas begat Abishua,","Eleazar chun Phinehas a nei a, Phinehas chun Abisua a nei a;"
5,"and Abishua begat Bukki, and Bukki begat Uzzi,",Abisua chun Bukki a nei a; Bukki chun Uzzi a nei a;
6,"and Uzzi begat Zerahiah, and Zerahiah begat Meraioth,","Uzzi chun Zerahia a nei a, Zerahia chun Meraioth a nei a;"
7,"Meraioth begat Amariah, and Amariah begat Ahitub,",Meraioth chun Amaria a nei a; Amaria chun Ahitub a nei a;
8,"and Ahitub begat Zadok, and Zadok begat Ahimaaz,",Ahitub chun Zadok a nei a; Zadok chun Ahimaaz a nei a;
9,"and Ahimaaz begat Azariah, and Azariah begat Johanan,",Ahimaaz chun Azaria a nei a; Azaria chun Johanan a nei a;
10,"and Johanan begat Azariah (he it is that executed the priest’s office in the house that Solomon built in Jerusalem),","Johanan chun Azaria a nei a, (Jerusalema Solomon a in bâwla thiempu sinthaw ding tira um kha a nih)."
11,"and Azariah begat Amariah, and Amariah begat Ahitub,","Azaria chun Amaria a nei a, Amaria chun Ahitub a nei a;"
12,"and Ahitub begat Zadok, and Zadok begat Shallum,","Ahitub chun Zadok a nei a, Zadok chun Sallum a nei a;"
13,"and Shallum begat Hilkiah, and Hilkiah begat Azariah,","Sallum chun Hilkia a nei a, Hilkia chun Azaria a nei a;"
14,"and Azariah begat Seraiah, and Seraiah begat Jehozadak;","Azaria chun Seraia a nei a, Seraia chun Jehozadak a nei a;"
15,"And Jehozadak went into captivity, when Jehovah carried away Judah and Jerusalem by the hand of Nebuchadnezzar.","Jehozadak chu sala ṭhuoiin a um a, Nebukadnezzar kuta LALPAIN Juda le Jerusalem ân ṭhuoi hmangtir lai khan."
16,"The sons of Levi: Gershom, Kohath, and Merari.","Levi naupasalhai chu: Gerson, Kohath le Merari."
17,And these are the names of the sons of Gershom: Libni and Shimei.,"Chun, hienghai hi Gerson naupasalhai hming chu a nih: Libni le Simei hi."
18,"And the sons of Kohath were Amram, and Izhar, and Hebron, and Uzziel.","Kohath naupasalhai chu: Amram, Izhar, Hebron le Uzziel an nih."
19,The sons of Merari: Mahli and Mushi. And these are the families of the Levites according to their fathers’ houses.,Merari naupasalhai chu: Mahli le Musi. Hieng hi an pahnam ang peia Levi hnam sûngkuohai chu an nih.
20,"Of Gershom: Libni his son, Jahath his son, Zimmah his son,","Gerson naupa chu Libni a na, ama naupa chu Jahath, ama naupa chu Zimma,"
21,"Joah his son, Iddo his son, Zerah his son, Jeatherai his son.","ama naupa chu Joa, ama naupa chu Iddo, ama naupa chu Zera, ama naupa chu Jeatherai."
22,"The sons of Kohath: Amminadab his son, Korah his son, Assir his son,","Kohath naupasalhai chu, Amminadab. Ama naupa chu Kora, ama naupa chu Assir,"
23,"Elkanah his son, and Ebiasaph his son, and Assir his son,","ama naupa chu Elkana, ama naupa chu Ebiasaph, ama naupa chu Assir a na;"
24,"Tahath his son, Uriel his son, Uzziah his son, and Shaul his son.","ama naupa chu Tahath, ama naupa chu Uriel, ama naupa chu Uzzia, ama naupa chu Saul."
25,"And the sons of Elkanah: Amasai, and Ahimoth.","Chun, Elkana naupasalhai chu: Amasai le Ahimoth."
26,"As for Elkanah, the sons of Elkanah: Zophai his son, and Nahath his son,","Elkana thua chun, Elkana naupasalhai chu: ama naupa Zophai, ama naupa Nahath;"
27,"Eliab his son, Jeroham his son, Elkanah his son.","ama naupa Eliab, ama naupa Jeroham, ama naupa Elkana."
28,"And the sons of Samuel: the first-born, Joel, and the second Abijah.","Samuel naupasalhai chu: nau lutîr chu Joel, a pahnina Abija."
29,"The sons of Merari: Mahli, Libni his son, Shimei his son, Uzzah his son,","Merari naupasalhai chu: Mahli, ama naupa Libni, ama naupa Simei, ama naupa Uzza;"
30,"Shimea his son, Haggiah his son, Asaiah his son.","ama naupa Simea, ama naupa Haggia, ama naupa Asaia."
31,"And these are they whom David set over the service of song in the house of Jehovah, after that the ark had rest.","Chun, Pathien bâwm chu a um ṭawk ṭawk hnunga, LALPA ina hla tienga rawngbâwla Davidin a siehai chu hienghai hi an nih."
32,"And they ministered with song before the tabernacle of the tent of meeting, until Solomon had built the house of Jehovah in Jerusalem: and they waited on their office according to their order.","Chuongchun, Jerusalem khuoa Solomonin LALPA in a bâwl hmakhat khan, inkhâwmna puon in biekbûk tuola chun hlain rawng an bâwl hlak a; an indawt ang peiin an rawngbâwl hun chu an nghâk hlak a."
33,"And these are they that waited, and their sons. Of the sons of the Kohathites: Heman the singer, the son of Joel, the son of Samuel,","Chun, hienghai hi a thawktu zinghai le an naupasalhai chu an nih. Kohath mi naupasalhai chu: hla sak mi Heman, Joel naupa, Samuel naupa chu;"
34,"the son of Elkanah, the son of Jeroham, the son of Eliel, the son of Toah,","Elkana naupa, Jeroham naupa, Eliel naupa, Toa naupa;"
35,"the son of Zuph, the son of Elkanah, the son of Mahath, the son of Amasai,","Zuph naupa, Elkana naupa, Mahath naupa, Amasai naupa;"
36,"the son of Elkanah, the son of Joel, the son of Azariah, the son of Zephaniah,","Elkana naupa, Joel naupa, Azaria naupa, Zephania naupa;"
37,"the son of Tahath, the son of Assir, the son of Ebiasaph, the son of Korah,","Tahath naupa, Assir naupa, Ebiasaph naupa, Kora naupa;"
38,"the son of Izhar, the son of Kohath, the son of Levi, the son of Israel.","Izhar naupa, Kohath naupa, Levi naupa, Israel naupa a nih."
39,"And his brother Asaph, who stood on his right hand, even Asaph the son of Berechiah, the son of Shimea,","Chun, a unaupa Asaph chu a changtienga ngîr hlak a na, chu Asaph ngei chu Berekia naupa a nih; Simea naupa;"
40,"the son of Michael, the son of Baaseiah, the son of Malchijah,","Mikael naupa, Baaseia naupa, Malkija naupa;"
41,"the son of Ethni, the son of Zerah, the son of Adaiah,","Ethni naupa, Zera naupa, Adaia naupa,"
42,"the son of Ethan, the son of Zimmah, the son of Shimei,","Ethan naupa, Zimma naupa, Simei naupa a nih."
43,"the son of Jahath, the son of Gershom, the son of Levi.","Jahath naupa, Gerson naupa, Levi naupa a nih."
44,"And on the left hand their brethren the sons of Merari: Ethan the son of Kishi, the son of Abdi, the son of Malluch,","Chun, vawitienga chun an unau Merari naupasalhai chu: Kisi naupa Ethan, Abdi naupa, Malluk naupa,"
45,"the son of Hashabiah, the son of Amaziah, the son of Hilkiah,","Hasabia naupa, Amazia naupa, Hilkia naupa;"
46,"the son of Amzi, the son of Bani, the son of Shemer,","Amzi naupa, Bani naupa, Semer naupa;"
47,"the son of Mahli, the son of Mushi, the son of Merari, the son of Levi.","Mahli naupa, Musi naupa, Merari naupa, Levi naupa a nih."
48,And their brethren the Levites were appointed for all the service of the tabernacle of the house of God.,"Chun, an unauhai Levi mihai chu Pathien ina biekbûka rawng- bâwlna po poa châng ding chun ruot an ni tah a."
49,"But Aaron and his sons offered upon the altar of burnt-offering, and upon the altar of incense, for all the work of the most holy place, and to make atonement for Israel, according to all that Moses the servant of God had commanded.","Amiruokchu, Aron le a naupa- salhai chu, Pathien siehlaw Mosien thu a lo pêk ta po po ang khan Israel- hai ta dinga intlanna siempêk dingin le, hmun inthiengtaka rawngbâwlna po poa ding chun pumrawhmang thilinhlânna mâichâm chunga le riminhnik rawna mâichâm chunga chun thil an inhlân a."
50,"And these are the sons of Aaron: Eleazar his son, Phinehas his son, Abishua his son,","Chun, hienghai hi Aron naupa- salhai chu an nih: ama naupa chu Eleazar, ama naupa chu Phinehas, ama naupa chu Abisua;"
51,"Bukki his son, Uzzi his son, Zerahiah his son,","ama naupa chu Bukki, ama naupa chu Uzzi, ama naupa chu Zerahia;"
52,"Meraioth his son, Amariah his son, Ahitub his son,","ama naupa chu Meraioth, ama naupa chu Amaria, ama naupa chu Ahitub;"
53,"Zadok his son, Ahimaaz his son.","ama naupa chu Zadok, ama naupa chu Ahimaaz a nih."
54,"Now these are their dwelling-places according to their encampments in their borders: to the sons of Aaron, of the families of the Kohathites (for theirs was the first lot),","Chun, hieng hi an ram sûnga an riebûk hmun ang peia an umna hmun hai chu a nih: Kohath mi sûngkuo, Aron naupasalhai chu, chan hmasa- tak chu anni ta a ni leiin,"
55,"to them they gave Hebron in the land of Judah, and the suburbs thereof round about it;",anni chu Juda rama Hebron le a vêlhai po po le chun pêk an na;
56,"but the fields of the city, and the villages thereof, they gave to Caleb the son of Jephunneh.","amiruokchu, a khawpui phûl le a khawperhai chu Jephunne naupa Kaleb kuomah an pêk a."
57,"And to the sons of Aaron they gave the cities of refuge, Hebron; Libnah also with its suburbs, and Jattir, and Eshtemoa with its suburbs,","Aron naupasalhai kuoma chun himna khawpui Hebron chu a pêk a; Libna chu a vêl khuohai leh, Jattir le Estemoa, a vêl khuohai leh,"
58,"and Hilen with its suburbs, Debir with its suburbs,","Hilen, a vêl khuohai leh, Debir, a vêl khuohai leh;"
59,"and Ashan with its suburbs, and Beth-shemesh with its suburbs;","Asan, a vêl khuohai leh, Beth- semes, a vêl khuohai leh;"
60,"and out of the tribe of Benjamin, Geba with its suburbs, and Allemeth with its suburbs, and Anathoth with its suburbs. All their cities throughout their families were thirteen cities.","chun, Benjamin hnama in- thawk chun; Geba, a vêl khuohai leh, Alemeth, a vêl khuohai leh, Anathoth a vêl khuohai leh. An pahnam po poa an khawpuihai po po chu khuo sâwm le pathum a nih."
61,"And unto the rest of the sons of Kohath were given by lot, out of the family of the tribe, out of the half-tribe, the half of Manasseh, ten cities.","Chun, Kohath naupasal dang- hai kuoma chun aisâna pêkin, hnam sûngkuo tina inthawk le, hnam zât- vea inthawk, Manasse hnam zâtvea inthawkin khawpui sâwm a nih."
62,"And to the sons of Gershom, according to their families, out of the tribe of Issachar, and out of the tribe of Asher, and out of the tribe of Naphtali, and out of the tribe of Manasseh in Bashan, thirteen cities.","Gerson naupasalhai kuoma chun an pahnam ang peiin, Issakar hnam chanpuola inthawk le, Aser hnam chanpuola inthawk le, Naph- tali hnam chanpuola inthawk le Basana Manasse hnam chanpuola inthawkin khawpui sâwm le pathum an pêk a."
63,"Unto the sons of Merari were given by lot, according to their families, out of the tribe of Reuben, and out of the tribe of Gad, and out of the tribe of Zebulun, twelve cities.","Merari naupasalhai kuoma chun aisâna pêkin, an pahnam ang peiin, Reuben hnam chanpuola in- thawk le, Gad hnam chanpuola inthawk le Zebulun hnam chanpuola inthawkin khawpui sâwm le pahni an pêk a."
64,And the children of Israel gave to the Levites the cities with their suburbs.,"Chuongchun, Israel thlahai chun Levi mihai chu khawpui le a vêl khuohai chu an pêk a."
65,"And they gave by lot out of the tribe of the children of Judah, and out of the tribe of the children of Simeon, and out of the tribe of the children of Benjamin, these cities which are mentioned by name.","Juda thlahai hnam chanpuola inthawk dâm, Simeon thlahai hnam chanpuola inthawk dâm, Benjamin thlahai hnam chanpuola inthawk dâmin hieng khawpui a hming hrila umhai hi, aisâna pêk an nih."
66,And some of the families of the sons of Kohath had cities of their borders out of the tribe of Ephraim.,"Chun, Kohath naupasalhai pa- hnam ṭhenkhat chun an biel sûnga chun Ephraim hnam chanpuola inthawk dâmin khawpuihai an nei a."
67,"And they gave unto them the cities of refuge, Shechem in the hill-country of Ephraim with its suburbs; Gezer also with its suburbs,",An kuoma Ephraim tlâng rama himna khawpui Sekem chu a vêl khuohai le chun an pêk a; Gezer le a vêl khuohai le khawm chun;
68,"and Jokmeam with its suburbs, and Beth-horon with its suburbs,","chun, Jokmeam, a vêl khuohai le chun, Beth-horon, a vêl khuohai leh;"
69,"and Aijalon with its suburbs, and Gath-rimmon with its suburbs;","Aijalon, a vêl khuohai leh, Gath-rimmon, a vêl khuohai leh;"
70,"and out of the half-tribe of Manasseh, Aner with its suburbs, and Bileam with its suburbs, for the rest of the family of the sons of Kohath.","Manasse hnam zâtve chanpuola inthawk chun: Aner, a vêl khuohai leh, Bileam, a vêl khuohai leh, Kohath naupasalhai pahnam dang- hai ta dinga pêk a na;"
71,"Unto the sons of Gershom were given, out of the family of the half-tribe of Manasseh, Golan in Bashan with its suburbs, and Ashtaroth with its suburbs;","Gerson naupasalhai kuoma chun aisânin, Manasse hnam zâtve chanpuola inthawkin Basana Golan chu a vêl khuohai leh pêk a na;"
72,"and out of the tribe of Issachar, Kedesh with its suburbs, Daberath with its suburbs,","Issakar hnama inthawkin Kedes, a vêl khuohai leh, Daberath, a vêl khuohai leh;"
73,"and Ramoth with its suburbs, and Anem with its suburbs;","Ramoth, a vêl khuohai leh, Anem, a vêl khuohai leh;"
74,"and out of the tribe of Asher, Mashal with its suburbs, and Abdon with its suburbs,","chun, Aser hnam chanpuola inthawkin: Masal, a vêl khuohai leh, Abdon, a vêl khuohai leh;"
75,"and Hukok with its suburbs, and Rehob with its suburbs;","Hukok, a vêl khuohai leh, Rehob, a vêl khuohai leh;"
76,"and out of the tribe of Naphtali, Kedesh in Galilee with its suburbs, and Hammon with its suburbs, and Kiriathaim with its suburbs.","Naphtali hnam chanpuola in- thawkin: Galilia Kades, a vêl khuohai leh, Hammon, a vêl khuohai leh, Kiriath-aim, a vêl khuohai leh."
77,"Unto the rest of the Levites, the sons of Merari, were given, out of the tribe of Zebulun, Rimmono with its suburbs, Tabor with its suburbs;","Levi mihai mi dang, Merari naupasalhai kuoma chun Zebulun hnam chanpuola inthawkin Rimmon, a vêl khuohai leh; Tabor, a vêl khuohai leh;"
78,"and beyond the Jordan at Jericho, on the east side of the Jordan, were given them, out of the tribe of Reuben, Bezer in the wilderness with its suburbs, and Jahzah with its suburbs,","chun, Jordan râla Jeriko vêlah, Jordan saktieng panga chun Reuben hnam chanpuola inthawkin thlalêra Bezer, a vêl khuohai leh pêk an nih; Jahza, a vêl khuohai leh,"
79,"and Kedemoth with its suburbs, and Mephaath with its suburbs;","Kedemoth, a vêl khuohai leh Mephaath, a vêl khuohai leh;"
80,"and out of the tribe of Gad, Ramoth in Gilead with its suburbs, and Mahanaim with its suburbs,","Gad hnam chanpuola inthawk- in Gilead rama Ramoth, a vêl khuo- hai leh, Mahanaim, a vêl khuohai leh,"
81,"and Heshbon with its suburbs, and Jazer with its suburbs.","Hesbon, a vêl khuohai leh, Jazer, a vêl khuohai leh."
