verse_no,en,hmr
1,"And it came to pass, at the time of the return of the year, at the time when kings go out to battle, that Joab led forth the army, and wasted the country of the children of Ammon, and came and besieged Rabbah. But David tarried at Jerusalem. And Joab smote Rabbah, and overthrew it.","Chun, kum a hung invawi a, lalhai chu indonaa an fe hlakna huna chun, Joab chun sipai thilthawtheina chu hmangin Ammon mihai ram chu a suksiet a, a hung a, Rabba khawm chu a hung inhuol tah a. Amiruokchu, David chu Jerusa- lema khan a um a, Joab chun Rabba chu a hung rûn a, a hne tah a."
2,"And David took the crown of their king from off his head, and found it to weigh a talent of gold, and there were precious stones in it; and it was set upon David’s head: and he brought forth the spoil of the city, exceeding much.","David chun an lal lua inthawk chun lallukhum chu a lâk a, râng- kachak talent tluka rik a nih, lunghluhai khawm a um bawk a; chu chu David lu chunga chun inkhumtir a ni tah a, khawpuia râllâk sumhai chu a hung lâk suok a, tam tak el a nih."
3,"And he brought forth the people that were therein, and cut them with saws, and with harrows of iron, and with axes. And thus did David unto all the cities of the children of Ammon. And David and all the people returned to Jerusalem.","Chutaka um mihai chu a hung ṭhuoi suok a, hreipui le thîr kuoi- kimhai le thing âtnahaiin anni chu sin ân thawtir tâwl a. Chuong ang seng chun David chun Ammon mihai khawpui po poa chun a thawh a. Chun, David le a mihai po po chu Jerusalema chun an kîr nâwk tah a."
4,"And it came to pass after this, that there arose war at Gezer with the Philistines: then Sibbecai the Hushathite slew Sippai, of the sons of the giant; and they were subdued.","Chun, hi hnunga hin Philistin mihai leh Gezerah indona a suok tah a; chun, Husath mi Sibbekai chun Rapha naupa Sippai chu a that a, anni chu an dawl tah a."
5,"And there was again war with the Philistines; and Elhanan the son of Jair slew Lahmi the brother of Goliath the Gittite, the staff of whose spear was like a weaver’s beam.",Chu hnunga chun Philistin mihai ma leh indona a um nâwk a; Git mi Goliath unaupa Lahmi chu Jair naupa Elhanan chun a that a; chu mipa feiṭhut chu puonkhâwngtu puonkawl ang a nih.
6,"And there was again war at Gath, where was a man of great stature, whose fingers and toes were four and twenty, six on each hand, and six on each foot; and he also was born unto the giant.","Chun, Gath-a chun indona a um nâwk a, chutaka chun mi lientak el hi a um a, a kepâr le kutpârhai chu sâwmhni le pali a na; kut pakhatah kutpâr paruk pei le, ke pakhatah kepâr paruk pei; ama khawm chu mi lien chia pieng hrim a nih."
7,"And when he defied Israel, Jonathan the son of Shimea David’s brother slew him.","Chun, ama chun Israel mihai a hung hrawk lai chun David unaupa Simea naupa Jonathan chun ama a that a."
8,"These were born unto the giant in Gath; and they fell by the hand of David, and by the hand of his servants.",Hienghai hi Gath khuoa mi lien hrima pienghai chu an nih; anni chu David le a siehlawhai kuta chun an lo tlu tah a.
