verse_no,en,hmr
1,"Jehovah, how are mine adversaries increased! Many are they that rise up against me.","LALPA, a mi dotuhai hi an va pung ta de! A mi hung thawtuhai hi tamtak an nih;"
2,"Many there are that say of my soul, There is no help for him in God. [Selah","“Pathiena chun a ta dingin ṭhangpuina hrim a um nawh,” tia, Ka hringna chungchâng thu hriltu tamtak an um."
3,"But thou, O Jehovah, art a shield about me; My glory, and the lifter up of my head.","Nisienlakhawm, aw LALPA, nang chu ka vêlin ka phaw i na, Ka ropuina le ka lu dawm kângtu i nih."
4,"I cry unto Jehovah with my voice, And he answereth me out of his holy hill. [Selah","Ka râwlin LALPA chu ka ko a, A tlâng inthienga inthawk chun a mi hung dawn hlak a."
5,I laid me down and slept; I awaked; for Jehovah sustaineth me.,"Kei chu ka zâl chu ka lo ininnghil tah a; Ka hang har nâwk a, LALPA chun a mi lo chel zing hlak a nih."
6,I will not be afraid of ten thousands of the people That have set themselves against me round about.,"Mi sîng khat khawm hi ṭi naw ning, Kei mi hung doa, mi hung inhuol vêltuhai hi."
7,"Arise, O Jehovah; save me, O my God: For thou hast smitten all mine enemies upon the cheek bone; Thou hast broken the teeth of the wicked.","Aw LALPA, tho la, aw ka Pathien; mi sandam rawh! Ka hmêlmahai po po bekbawra chun i benpêk tâwl ta sih a; Mi rilohai hahai chu i suk- tlam a."
8,Salvation belongeth unto Jehovah: Thy blessing be upon thy people. [Selah,"Sandamna chu LALPA ta a na, I malsâwmna chu i mihai chungah um raw se."
