verse_no,en,hmr
1,"Out of the depths have I cried unto thee, O Jehovah.","Aw LALPA, tui inthûktakainthawk hin ka ko che hi."
2,"Lord, hear my voice: Let thine ears be attentive To the voice of my supplications.","LALPA, ka râwl hi lo ngai la, Lunginsiet ka hnina râwl hi, I nain lo ngai raw se."
3,"If thou, Jehovah, shouldest mark iniquities, O Lord, who could stand?","LALPA, nangin rîtlonahai în chik chun, Aw LALPA, tu am ngîr an ti leh?"
4,"But there is forgiveness with thee, That thou mayest be feared.","Nisienlakhawm, i kuomah ngaidamna a um a nih, Ṭiha i um theina dingin."
5,"I wait for Jehovah, my soul doth wait, And in his word do I hope.","LALPA chu ka nghâk zing a, ka hringna hin a nghâk zing a, A thu khawm ka beisei a nih."
6,"My soul waiteth for the Lord More than watchmen wait for the morning; Yea, more than watchmen for the morning.","Vêngtuhaiin khawvar an thlîr nêka nasain, Anih, vêngtuhaiin khawvar an thlîr nêka nasa hmanin, Ka hringna hin LALPA chu a thlîr zing hlak a nih."
7,"O Israel, hope in Jehovah; For with Jehovah there is lovingkindness, And with him is plenteous redemption.","Aw Israelhai, LALPA chu beisei ro; LALPA kuoma chun ngilneina a um sih a, A kuomah intlanna tamtak a um bawk a."
8,And he will redeem Israel From all his iniquities.,"Chuongchun, ama chun Israelhai chu, An rîtlona po poa inthawkin sansuok a tih."
