verse_no,en,hmr
1,"God be merciful unto us, and bless us, And cause his face to shine upon us; [Selah","Pathienin mi lunginsiet sienla, mal mi sâwm sienla; A hmêl chu ei chungah hung invartir raw se."
2,"That thy way may be known upon earth, Thy salvation among all nations.",I lampui chu hnuoi chunga mi hriet a ni thei a; I sandamna chu hnam tinrêng laia hriet a ni theina dingin.
3,"Let the peoples praise thee, O God; Let all the peoples praise thee.","Aw Pathien, mi tinin inpâk sienla che, Mi tinrênghai chun inpâk raw hai se che."
4,"Oh let the nations be glad and sing for joy; For thou wilt judge the peoples with equity, And govern the nations upon earth. [Selah","Aw, hnam tin chu lâwmtaka umin, hlimin hla sak raw se. Nangin mi tin chu thlierbîk nei loa ro rêlpêkin: Hnuoi chunga hnam tin chu i awp ding a ni sih a."
5,"Let the peoples praise thee, O God; Let all the peoples praise thee.","Aw Pathien, mi tinin inpâk sienla che, Mi tinrênghai chun inpâk raw hai se che."
6,"The earth hath yielded its increase: God, even our own God, will bless us.","Hnuoi hin a thil ṭo chu a pêk a, Pathien, eini Pathien ngei chun mal mi sâwm a ta."
7,God will bless us; And all the ends of the earth shall fear him.,"Pathienin mal mi sâwm a ta, Kâwlkawdawnga mi po po khawmin ama ṭîng an tih."
