verse_no,en,hmr
1,"I was glad when they said unto me, Let us go unto the house of Jehovah.","“LALPA inah fêng ei tiu,” Ka kuoma an ti lai khan ka lâwm a."
2,"Our feet are standing Within thy gates, O Jerusalem,","Aw Jerusalem, i kul kawtkhâr sûngah, Kan kehai chu a ngîr ta hi."
3,"Jerusalem, that art builded As a city that is compact together;","Jerusalem, khawpui indin thar, Detindo taka rem chu."
4,"Whither the tribes go up, even the tribes of Jehovah, For an ordinance for Israel, To give thanks unto the name of Jehovah.","LALPA hming inpâk dingin, Chutaka chun hnamhai chu an hang fe hlak, LALPA hnamhai chu, Israelhai kuoma thuinhriettirna dingin."
5,"For there are set thrones for judgment, The thrones of the house of David.","Chutaka chun rorêlna dingin ṭhungphahai daw a ni sih a, David sûnghai lalṭhungphahai chu."
6,Pray for the peace of Jerusalem: They shall prosper that love thee.,"Jerusalem thlamuongna ding hnipêk ro, Nangma ngainatuhai chu thawveng an tih."
7,"Peace be within thy walls, And prosperity within thy palaces.","I kul sûnga chun thlamuongna um sienla, I lal inhaia chun thawvengna um raw se."
8,"For my brethren and companions’ sakes, I will now say, Peace be within thee.","Ka unauhai le ka ruolhai leiin, “I sûngah thlamuongna um raw se,” tîng ka tih."
9,For the sake of the house of Jehovah our God I will seek thy good.,"LALPA ei Pathien in lei chun, I ṭhatna ding zawng ka tih."
