verse_no,en,hmr
1,"The fool hath said in his heart, There is no God. Corrupt are they, and have done abominable iniquity; There is none that doeth good.","Mi invêt chun a lungrilin, ““Pathien hrim a um nawh,” a ti hlak a; Tukhawm thil ṭha thaw hrim an um nawh. An se zo a, thil suol tirdakum- tak an thawh a;"
2,"God looked down from heaven upon the children of men, To see if there were any that did understand, That did seek after God.","Hrethiema Pathien zawng hrim hrim an um am? ti hmu dingin, Pathienin vâna inthawkin mi- hriem nauhai hi a zuk en a."
3,"Every one of them is gone back; they are together become filthy; There is none that doeth good, no, not one.","An kîr nâwk ta seng a, pawrchetakin an lo um ta vawng a; Tukhawm thil ṭha thaw hrim an um nawh, pakhat bêk khawm an um dêr nawh."
4,"Have the workers of iniquity no knowledge, Who eat up my people as they eat bread, And call not upon God?","Thilsuol thawtuhai chun hriet hrim hrim an nei naw am a nih? Bei an fâk angin ka mihai an fâk zo vawng hlak a, Pathien hlak an ko ngai bawk nawh."
5,"There were they in great fear, where no fear was; For God hath scattered the bones of him that encampeth against thee: Thou hast put them to shame, because God hath rejected them.",Ṭitna hrim hrim um nawnaa chun ṭi êm êmin an um a. Pathienin thaw tuma eptu che ruhai chu a sukdar ta sih a; Pathienin anni chu a pei thlâk leiin i sukmuolpho tah a.
6,"Oh that the salvation of Israel were come out of Zion! When God bringeth back the captivity of his people, Then shall Jacob rejoice, and Israel shall be glad.","Israelhai sandamna chu Ziona inthawkin suok sienla chu aw! Pathien chun a mihai sala an um chu a ṭhuoi kîr nâwk pha chun, Chu pha chun Jakobrawi hlim tâng an ta, Israelrawi lâwm tâng an tih."
